{
  "meta": { "title": "Simple line + points example" },
  "data": [
    {
      "name": "series1",
      "values": [
        { "x": 0, "y": 1 },
        { "x": 1, "y": 2 },
        { "x": 2, "y": 1.5 },
        { "x": 3, "y": 3 }
      ]
    }
  ],
  "scales": {
    "xscale": { "type": "linear", "domain": [0, 3] },
    "yscale": { "type": "linear", "domain": [0, 4] }
  },
  "axes": [
    { "orient": "bottom", "scale": "xscale", "ticks": 4 },
    { "orient": "left", "scale": "yscale", "ticks": 4 }
  ],
  "marks": [
    { "type": "line", "from": "series1", "encoding": { "x": { "field": "x", "scale": "xscale" }, "y": { "field": "y", "scale": "yscale" }, "color": { "value": "#1b7a4a" } }, "layer": "marks" },
    { "type": "point", "from": "series1", "encoding": { "x": { "field": "x", "scale": "xscale" }, "y": { "field": "y", "scale": "yscale" }, "color": { "value": "#ffd166" }, "size": { "value": 6 } }, "layer": "marks" }
  ]
}
